{
  "schemaVersion": 1,
  "provider": "git",
  "root": "upstream.zip",
  "source": {
    "url": "https://github.com/mattpocock/skills",
    "revision": "6fd947921b935b7e1e69293a200400f0fdd5c15f",
    "subtree": "skills/engineering/codebase-design"
  },
  "files": {
    "agents/openai.yaml": "edebc9e4fcfe102114012575eaa9600b9b5fd08c311664f389c36e7bc717740f",
    "DEEPENING.md": "f3dd099ce99289bd213914d8ee3e2429b78309c3957ca4583f7659551b1d53c1",
    "DESIGN-IT-TWICE.md": "52b52e75655a27aea59c6966b410bac82448968ad46ef1ebb9f07c274e3ae010",
    "SKILL.md": "2c20617f87ec8af6a434859f381b2f061a69b530444e74eb39e78bb016a6d1e2"
  },
  "dependencies": [
    "agentic-workflow"
  ]
}
