{
  "schemaVersion": 1,
  "provider": "git",
  "root": "upstream.zip",
  "source": {
    "url": "https://github.com/mattpocock/skills",
    "revision": "6fd947921b935b7e1e69293a200400f0fdd5c15f",
    "subtree": "skills/engineering/tdd"
  },
  "files": {
    "agents/openai.yaml": "ea6f01cf1b8c06a4b0f5b649d74b1b8ce8685e72af1b38d70d877693e092af0b",
    "mocking.md": "3ceb807fdf4a47d6a93d4d9a891e5ba6d362a6247bd08adc451feebfc17361ef",
    "SKILL.md": "93ea419b76e9caaf26153b828e984f7c3fb136f4caa67b14af95f32ea965a1cc",
    "tests.md": "859f9e592c188fda4fc7277dd180e4ce9c7a2e13f6efe1f6f29eccc9d28c106a"
  },
  "dependencies": [
    "agentic-workflow",
    "codebase-design",
    "review-and-submit",
    "code-review"
  ]
}
